Welcome to the MySQL monitor.  Commands end with ; or \g.
Your MySQL connection id is 8
Server version: 8.0.23-0ubuntu0.20.10.1 (Ubuntu)

Copyright (c) 2000, 2021, Oracle and/or its affiliates.

Oracle is a registered trademark of Oracle Corporation and/or its
affiliates. Other names may be trademarks of their respective
owners.

Type 'help;' or '\h' for help. Type '\c' to clear the current input statement.

mysql> use themepark
Reading table information for completion of table and column names
You can turn off this feature to get a quicker startup with -A

Database changed
mysql> 


mysql> CREATE VIEW EMP_WORKED AS
    -> SELECT E.EMP_LNAME, E.EMP_FNAME, H.ATTRACT_NO,H.DATE_WORKED
    -> FROM employee E JOIN hours H
    -> ON E.EMP_NUM = H.EMP_NUM;
ERROR 1146 (42S02): Table 'themepark.employee' doesn't exist
mysql> CREATE VIEW EMP_WORKED AS
    -> SELECT E.EMP_LNAME, E.EMP_FNAME, H.ATTRACT_NO,H.DATE_WORKED
    -> FROM employee E JOIN hours H
    -> 
    -> ;
ERROR 1146 (42S02): Table 'themepark.employee' doesn't exist
mysql> ELECT E.EMP_LNAME, E.EMP_FNAME, H.ATTRACT_NO,H.DATE_WORKED
    -> FROM employee E JOIN hours H
    -> ON E.EMP_NUM = H.EMP_NUM;
ERROR 1064 (42000): You have an error in your SQL syntax; check the manual that corresponds to your MySQL server version for the right syntax to use near 'ELECT E.EMP_LNAME, E.EMP_FNAME, H.ATTRACT_NO,H.DATE_WORKED
FROM employee E JOIN ' at line 1
mysql> SELECT E.EMP_LNAME, E.EMP_FNAME, H.ATTRACT_NO,H.DATE_WORKED FROM employee E JOIN hours H ON E.EMP_NUM = H.EMP_NUM;
ERROR 1146 (42S02): Table 'themepark.employee' doesn't exist
mysql> 


mysql> SELECT * FROM EMPLOYEE
    -> ;
+---------+-----------+------------+-----------+------------+---------------+---------------+-----------+-----------+
| EMP_NUM | EMP_TITLE | EMP_LNAME  | EMP_FNAME | EMP_DOB    | EMP_HIRE_DATE | EMP_AREA_CODE | EMP_PHONE | PARK_CODE |
+---------+-----------+------------+-----------+------------+---------------+---------------+-----------+-----------+
|     100 | Ms        | Calderdale | Emma      | 1972-06-15 | 1992-03-15    | 0181          | 324-9134  | FR1001    |
|     101 | Ms        | Ricardo    | Marshel   | 1978-03-19 | 1996-04-25    | 0181          | 324-4472  | UK3452    |
|     102 | Mr        | Arshad     | Arif      | 1969-11-14 | 1990-12-20    | 7253          | 675-8993  | FR1001    |
|     103 | Ms        | Roberts    | Anne      | 1974-10-16 | 1994-08-16    | 0181          | 898-3456  | UK3452    |
|     104 | Mr        | Denver     | Enrica    | 1980-11-08 | 2001-10-20    | 7253          | 504-4434  | ZA1342    |
|     105 | Ms        | Namowa     | Mirrelle  | 1990-03-14 | 2006-11-08    | 0181          | 890-3243  | FR1001    |
|     106 | Mrs       | Smith      | Gemma     | 1968-02-12 | 1989-01-05    | 0181          | 324-7845  | ZA1342    |
+---------+-----------+------------+-----------+------------+---------------+---------------+-----------+-----------+
7 rows in set (0.05 sec)

mysql> SELECT * FROM HOURS;
+---------+------------+-------------------+-----------+-------------+
| EMP_NUM | ATTRACT_NO | HOURS_PER_ATTRACT | HOUR_RATE | DATE_WORKED |
+---------+------------+-------------------+-----------+-------------+
|     100 |      10034 |                 6 |      6.50 | 2007-05-18  |
|     100 |      10034 |                 6 |      6.50 | 2007-05-20  |
|     101 |      10034 |                 6 |      6.50 | 2007-05-18  |
|     102 |      30012 |                 3 |      5.99 | 2007-05-23  |
|     102 |      30044 |                 6 |      5.99 | 2007-05-21  |
|     102 |      30044 |                 3 |      5.99 | 2007-05-22  |
|     104 |      30011 |                 6 |      7.20 | 2007-05-21  |
|     104 |      30012 |                 6 |      7.20 | 2007-05-22  |
|     105 |      10078 |                 3 |      8.50 | 2007-05-18  |
|     105 |      10098 |                 3 |      8.50 | 2007-05-18  |
|     105 |      10098 |                 6 |      8.50 | 2007-05-19  |
+---------+------------+-------------------+-----------+-------------+
11 rows in set (0.04 sec)

mysql> SELECT EMP_LNAME,EMP_LNAME, ATTRACT_NO,DATE_WORKED 
    -> FROM EMPLOYEE E NATURAL JOIN HOURS H
    -> ON E.EMP_NUM = H.EMP_NUM;
ERROR 1064 (42000): You have an error in your SQL syntax; check the manual that corresponds to your MySQL server version for the right syntax to use near 'ON E.EMP_NUM = H.EMP_NUM' at line 3
mysql> SELECT EMP_LNAME,EMP_LNAME, ATTRACT_NO,DATE_WORKED  FROM EMPLOYEE E NATURAL JOIN HOURS H IN E.EMP_NUM = H.EMP_NUM;
ERROR 1064 (42000): You have an error in your SQL syntax; check the manual that corresponds to your MySQL server version for the right syntax to use near 'IN E.EMP_NUM = H.EMP_NUM' at line 1
mysql> 
mysql> SELECT EMP_LNAME,EMP_LNAME, ATTRACT_NO,DATE_WORKED  FROM EMPLOYEE E NATURAL JOIN HOURS H WHERE  E.EMP_NUM = H.EMP_NUM;
+------------+------------+------------+-------------+
| EMP_LNAME  | EMP_LNAME  | ATTRACT_NO | DATE_WORKED |
+------------+------------+------------+-------------+
| Calderdale | Calderdale |      10034 | 2007-05-18  |
| Calderdale | Calderdale |      10034 | 2007-05-20  |
| Ricardo    | Ricardo    |      10034 | 2007-05-18  |
| Arshad     | Arshad     |      30012 | 2007-05-23  |
| Arshad     | Arshad     |      30044 | 2007-05-21  |
| Arshad     | Arshad     |      30044 | 2007-05-22  |
| Denver     | Denver     |      30011 | 2007-05-21  |
| Denver     | Denver     |      30012 | 2007-05-22  |
| Namowa     | Namowa     |      10078 | 2007-05-18  |
| Namowa     | Namowa     |      10098 | 2007-05-18  |
| Namowa     | Namowa     |      10098 | 2007-05-19  |
+------------+------------+------------+-------------+
11 rows in set (0.00 sec)

mysql> CREATE VIEW EMP_WORKED AS 
    -> SELECT EMP_LNAME,EMP_LNAME, ATTRACT_NO,DATE_WORKED  FROM EMPLOYEE E NATURAL JOIN HOURS H WHERE  E.EMP_NUM = H.EMP_NUM;
ERROR 1060 (42S21): Duplicate column name 'EMP_LNAME'
mysql> CREATE VIEW EMP_WORKED AS  SELECT EMP_LNAME,EMP_FNAME, ATTRACT_NO,DATE_WORKED  FROM EMPLOYEE E NATURAL JOIN HOURS H WHERE  E.EMP_NUM = H.EMP_NUM;
Query OK, 0 rows affected (0.24 sec)

mysql> SELECT * FROM EMP_WORKED;
+------------+-----------+------------+-------------+
| EMP_LNAME  | EMP_FNAME | ATTRACT_NO | DATE_WORKED |
+------------+-----------+------------+-------------+
| Calderdale | Emma      |      10034 | 2007-05-18  |
| Calderdale | Emma      |      10034 | 2007-05-20  |
| Ricardo    | Marshel   |      10034 | 2007-05-18  |
| Arshad     | Arif      |      30012 | 2007-05-23  |
| Arshad     | Arif      |      30044 | 2007-05-21  |
| Arshad     | Arif      |      30044 | 2007-05-22  |
| Denver     | Enrica    |      30011 | 2007-05-21  |
| Denver     | Enrica    |      30012 | 2007-05-22  |
| Namowa     | Mirrelle  |      10078 | 2007-05-18  |
| Namowa     | Mirrelle  |      10098 | 2007-05-18  |
| Namowa     | Mirrelle  |      10098 | 2007-05-19  |
+------------+-----------+------------+-------------+
11 rows in set (0.00 sec)

mysql> DROP VIEW EMP_WORKED;
Query OK, 0 rows affected (0.21 sec)

mysql> CREATE VIEW EMPFR
    -> SELECT *
    -> FROM EMPLOYEE
    -> AS
    -> WHERE PARK_CODE = ‘FR1001’
    -> WITH CHECK OPTION;
ERROR 1064 (42000): You have an error in your SQL syntax; check the manual that corresponds to your MySQL server version for the right syntax to use near 'SELECT *
FROM EMPLOYEE
AS
WHERE PARK_CODE = ‘FR1001’
WITH CHECK OPTION' at line 2
mysql> CREATE VIEW EMPFR
    -> SELECT *
    -> FROM EMPLOYEE
    -> AS
    -> WHERE PARK_CODE = ‘FR1001’
    -> AS
    -> ;
ERROR 1064 (42000): You have an error in your SQL syntax; check the manual that corresponds to your MySQL server version for the right syntax to use near 'SELECT *
FROM EMPLOYEE
AS
WHERE PARK_CODE = ‘FR1001’
AS' at line 2
mysql> CREATE VIEW EMPFR
    -> SELECT *
    -> FROM EMPLOYEE
    -> AS
    -> WHERE PARK_CODE = ‘FR1001’
    -> WITH CHECK OPTION;
ERROR 1064 (42000): You have an error in your SQL syntax; check the manual that corresponds to your MySQL server version for the right syntax to use near 'SELECT *
FROM EMPLOYEE
AS
WHERE PARK_CODE = ‘FR1001’
WITH CHECK OPTION' at line 2
mysql> CREATE VIEW EMPFR SELECT * FROM EMPLOYEE AS WHERE PARK_CODE = 'FR1001' WITH CHECK OPTION;
ERROR 1064 (42000): You have an error in your SQL syntax; check the manual that corresponds to your MySQL server version for the right syntax to use near 'SELECT * FROM EMPLOYEE AS WHERE PARK_CODE = 'FR1001' WITH CHECK OPTION' at line 1
mysql> CREATE VIEW EMPFR SELECT * FROM EMPLOYEE AS WHERE PARK_CODE = 'FR1001' WITH CHECK OPTION;
ERROR 1064 (42000): You have an error in your SQL syntax; check the manual that corresponds to your MySQL server version for the right syntax to use near 'SELECT * FROM EMPLOYEE AS WHERE PARK_CODE = 'FR1001' WITH CHECK OPTION' at line 1
mysql> CREATE VIEW EMPFR
    -> SELECT *
    -> FROM EMPLOYEE
    -> WHERE PARK_CODE = 'FR1001'
    -> WITH CHECK OPTION;
ERROR 1064 (42000): You have an error in your SQL syntax; check the manual that corresponds to your MySQL server version for the right syntax to use near 'SELECT *
FROM EMPLOYEE
WHERE PARK_CODE = 'FR1001'
WITH CHECK OPTION' at line 2
mysql> CREATE VIEW EMPFR SELECT * FROM EMPLOYEE WHERE PARK_CODE = 'FR1001' WITH CHECK OPTION;
ERROR 1064 (42000): You have an error in your SQL syntax; check the manual that corresponds to your MySQL server version for the right syntax to use near 'SELECT * FROM EMPLOYEE WHERE PARK_CODE = 'FR1001' WITH CHECK OPTION' at line 1
mysql> SELECT * FROM EMPLOYEE;
+---------+-----------+------------+-----------+------------+---------------+---------------+-----------+-----------+
| EMP_NUM | EMP_TITLE | EMP_LNAME  | EMP_FNAME | EMP_DOB    | EMP_HIRE_DATE | EMP_AREA_CODE | EMP_PHONE | PARK_CODE |
+---------+-----------+------------+-----------+------------+---------------+---------------+-----------+-----------+
|     100 | Ms        | Calderdale | Emma      | 1972-06-15 | 1992-03-15    | 0181          | 324-9134  | FR1001    |
|     101 | Ms        | Ricardo    | Marshel   | 1978-03-19 | 1996-04-25    | 0181          | 324-4472  | UK3452    |
|     102 | Mr        | Arshad     | Arif      | 1969-11-14 | 1990-12-20    | 7253          | 675-8993  | FR1001    |
|     103 | Ms        | Roberts    | Anne      | 1974-10-16 | 1994-08-16    | 0181          | 898-3456  | UK3452    |
|     104 | Mr        | Denver     | Enrica    | 1980-11-08 | 2001-10-20    | 7253          | 504-4434  | ZA1342    |
|     105 | Ms        | Namowa     | Mirrelle  | 1990-03-14 | 2006-11-08    | 0181          | 890-3243  | FR1001    |
|     106 | Mrs       | Smith      | Gemma     | 1968-02-12 | 1989-01-05    | 0181          | 324-7845  | ZA1342    |
+---------+-----------+------------+-----------+------------+---------------+---------------+-----------+-----------+
7 rows in set (0.00 sec)

mysql> CREATE VIEW EMPFR 
    -> SELECT * FROM EMPLPYEE
    -> WHHERE PARK_CODE ='FR1001'
    -> WITH CHECK OPTION;
ERROR 1064 (42000): You have an error in your SQL syntax; check the manual that corresponds to your MySQL server version for the right syntax to use near 'SELECT * FROM EMPLPYEE
WHHERE PARK_CODE ='FR1001'
WITH CHECK OPTION' at line 2
mysql> SELECT *
FROM EMPLOYEE
AS
WHERE PARK_CODE = ‘FR1001’
WITH CHECK OPTION;SELECT *
^C
mysql> FROM EMPLOYEE
    -> AS
    -> WHERE PARK_CODE = ‘FR1001’
    -> WITH CHECK OPTION;
ERROR 1064 (42000): You have an error in your SQL syntax; check the manual that corresponds to your MySQL server version for the right syntax to use near 'FROM EMPLOYEE
AS
WHERE PARK_CODE = ‘FR1001’
WITH CHECK OPTION' at line 1
mysql> SELECT * FROM EMPLOYEE AS WHERE PARK_CODE = ‘FR1001’ WITH CHECK OPTION;
ERROR 1064 (42000): You have an error in your SQL syntax; check the manual that corresponds to your MySQL server version for the right syntax to use near 'WHERE PARK_CODE = ‘FR1001’ WITH CHECK OPTION' at line 1
mysql> SELECT * FROM EMPLOYEE AS WHERE PARK_CODE = 'FR1001' WITH CHECK OPTION;
ERROR 1064 (42000): You have an error in your SQL syntax; check the manual that corresponds to your MySQL server version for the right syntax to use near 'WHERE PARK_CODE = 'FR1001' WITH CHECK OPTION' at line 1
mysql> SELECT * FROM EMPLOYEE;
+---------+-----------+------------+-----------+------------+---------------+---------------+-----------+-----------+
| EMP_NUM | EMP_TITLE | EMP_LNAME  | EMP_FNAME | EMP_DOB    | EMP_HIRE_DATE | EMP_AREA_CODE | EMP_PHONE | PARK_CODE |
+---------+-----------+------------+-----------+------------+---------------+---------------+-----------+-----------+
|     100 | Ms        | Calderdale | Emma      | 1972-06-15 | 1992-03-15    | 0181          | 324-9134  | FR1001    |
|     101 | Ms        | Ricardo    | Marshel   | 1978-03-19 | 1996-04-25    | 0181          | 324-4472  | UK3452    |
|     102 | Mr        | Arshad     | Arif      | 1969-11-14 | 1990-12-20    | 7253          | 675-8993  | FR1001    |
|     103 | Ms        | Roberts    | Anne      | 1974-10-16 | 1994-08-16    | 0181          | 898-3456  | UK3452    |
|     104 | Mr        | Denver     | Enrica    | 1980-11-08 | 2001-10-20    | 7253          | 504-4434  | ZA1342    |
|     105 | Ms        | Namowa     | Mirrelle  | 1990-03-14 | 2006-11-08    | 0181          | 890-3243  | FR1001    |
|     106 | Mrs       | Smith      | Gemma     | 1968-02-12 | 1989-01-05    | 0181          | 324-7845  | ZA1342    |
+---------+-----------+------------+-----------+------------+---------------+---------------+-----------+-----------+
7 rows in set (0.00 sec)

mysql> SELECT * FROM EMPLOYEE  WHERE PARK_CODE = 'FR1001' WITH CHECK OPTION;
ERROR 1064 (42000): You have an error in your SQL syntax; check the manual that corresponds to your MySQL server version for the right syntax to use near 'WITH CHECK OPTION' at line 1
mysql> SELECT * FROM EMPLOYEE  WHERE PARK_CODE = 'FR1001';
+---------+-----------+------------+-----------+------------+---------------+---------------+-----------+-----------+
| EMP_NUM | EMP_TITLE | EMP_LNAME  | EMP_FNAME | EMP_DOB    | EMP_HIRE_DATE | EMP_AREA_CODE | EMP_PHONE | PARK_CODE |
+---------+-----------+------------+-----------+------------+---------------+---------------+-----------+-----------+
|     100 | Ms        | Calderdale | Emma      | 1972-06-15 | 1992-03-15    | 0181          | 324-9134  | FR1001    |
|     102 | Mr        | Arshad     | Arif      | 1969-11-14 | 1990-12-20    | 7253          | 675-8993  | FR1001    |
|     105 | Ms        | Namowa     | Mirrelle  | 1990-03-14 | 2006-11-08    | 0181          | 890-3243  | FR1001    |
+---------+-----------+------------+-----------+------------+---------------+---------------+-----------+-----------+
3 rows in set (0.00 sec)

mysql> CREATE VIEW EMPFR AS 
    -> SELECT * FROM EMPLOYEE  WHERE PARK_CODE = 'FR1001';
Query OK, 0 rows affected (0.95 sec)

mysql> SELECT * FROM EMPFRF;
ERROR 1146 (42S02): Table 'themepark.EMPFRF' doesn't exist
mysql> SELECT * FROM EMPFR;
+---------+-----------+------------+-----------+------------+---------------+---------------+-----------+-----------+
| EMP_NUM | EMP_TITLE | EMP_LNAME  | EMP_FNAME | EMP_DOB    | EMP_HIRE_DATE | EMP_AREA_CODE | EMP_PHONE | PARK_CODE |
+---------+-----------+------------+-----------+------------+---------------+---------------+-----------+-----------+
|     100 | Ms        | Calderdale | Emma      | 1972-06-15 | 1992-03-15    | 0181          | 324-9134  | FR1001    |
|     102 | Mr        | Arshad     | Arif      | 1969-11-14 | 1990-12-20    | 7253          | 675-8993  | FR1001    |
|     105 | Ms        | Namowa     | Mirrelle  | 1990-03-14 | 2006-11-08    | 0181          | 890-3243  | FR1001    |
+---------+-----------+------------+-----------+------------+---------------+---------------+-----------+-----------+
3 rows in set (0.00 sec)

mysql> UPDATE VIEW EMPFR 
    -> SET PARK_CODE 'UK3452'
    -> WHERE EMP_NUM =100;
ERROR 1064 (42000): You have an error in your SQL syntax; check the manual that corresponds to your MySQL server version for the right syntax to use near ''UK3452'
WHERE EMP_NUM =100' at line 2
mysql> UPDATE VIEW EMPFR  SET PARK_CODE 'UK3452' WHERE EMP_NUM =102;
ERROR 1064 (42000): You have an error in your SQL syntax; check the manual that corresponds to your MySQL server version for the right syntax to use near ''UK3452' WHERE EMP_NUM =102' at line 1
mysql> UPDATE VIEW EMPFR  SET PARK_CODE 'UK3452' WHERE EMP_NUM =103;
ERROR 1064 (42000): You have an error in your SQL syntax; check the manual that corresponds to your MySQL server version for the right syntax to use near ''UK3452' WHERE EMP_NUM =103' at line 1
mysql> SELECT DAYOFMONTH(EMP_DOB) AS "Day", MONTH(EMP_DOB) AS "Month",
    ->     -> YEAR(EMP_DOB) AS "Year"
    ->     -> FROM EMPLOYEE;
ERROR 1064 (42000): You have an error in your SQL syntax; check the manual that corresponds to your MySQL server version for the right syntax to use near '-> YEAR(EMP_DOB) AS "Year"
    -> FROM EMPLOYEE' at line 2
mysql>  SELECT DISTINCT(SALE_DATE )
    -> FROM SALES;
+------------+
| SALE_DATE  |
+------------+
| 2007-05-18 |
+------------+
1 row in set (0.08 sec)

mysql> SELECT DISTINCT(DATE_FORMAT(SALE_DATE, ‘%D %b %Y’))
    -> FROM SALES;
ERROR 1054 (42S22): Unknown column '‘' in 'field list'
mysql> SELECT DISTINCT(DATE_FORMAT(SALE_DATE, '%D %b %Y')) FROM SALES;
+--------------------------------------+
| (DATE_FORMAT(SALE_DATE, '%D %b %Y')) |
+--------------------------------------+
| 18th May 2007                        |
+--------------------------------------+
1 row in set (0.04 sec)

mysql> CURRENT DATE and CURRENT TIME
    -> ;
ERROR 1064 (42000): You have an error in your SQL syntax; check the manual that corresponds to your MySQL server version for the right syntax to use near 'CURRENT DATE and CURRENT TIME' at line 1
mysql> CURRENT DATE and CURRENT TIME;
ERROR 1064 (42000): You have an error in your SQL syntax; check the manual that corresponds to your MySQL server version for the right syntax to use near 'CURRENT DATE and CURRENT TIME' at line 1
mysql> CURRENT DATE, CURRENT TIME;
ERROR 1064 (42000): You have an error in your SQL syntax; check the manual that corresponds to your MySQL server version for the right syntax to use near 'CURRENT DATE, CURRENT TIME' at line 1
mysql> SELECT DISTINCT(SALE_DATE )
    -> FROM SALES;
+------------+
| SALE_DATE  |
+------------+
| 2007-05-18 |
+------------+
1 row in set (0.00 sec)

mysql> SELECT DISTINCT(DATE_FORMAT(SALE_DATE, ‘%D %b %Y’))
    -> FROM SALES;
ERROR 1054 (42S22): Unknown column '‘' in 'field list'
mysql> SELECT DISTINCT(DATE_FORMAT(SALE_DATE, '%D %b %Y')) FROM SALES;
+--------------------------------------+
| (DATE_FORMAT(SALE_DATE, '%D %b %Y')) |
+--------------------------------------+
| 18th May 2007                        |
+--------------------------------------+
1 row in set (0.00 sec)

mysql> SELECT CURRENT_DATE(), CURRENT_TIME();
+----------------+----------------+
| CURRENT_DATE() | CURRENT_TIME() |
+----------------+----------------+
| 2021-04-10     | 23:23:48       |
+----------------+----------------+
1 row in set (0.03 sec)

mysql> SELECT CURRENT_DATE(), CURRENT_TIME();
+----------------+----------------+
| CURRENT_DATE() | CURRENT_TIME() |
+----------------+----------------+
| 2021-04-10     | 23:23:52       |
+----------------+----------------+
1 row in set (0.00 sec)

mysql> SELECT DISTINCT(DATE_FORMAT(SALE_DATE, '%D %b %Y')) FROM SALES;
+--------------------------------------+
| (DATE_FORMAT(SALE_DATE, '%D %b %Y')) |
+--------------------------------------+
| 18th May 2007                        |
+--------------------------------------+
1 row in set (0.00 sec)

mysql> 
mysql> SELECT DISTINCT(DATE_FORMAT(SALE_DATE, '%D %b %Y')) FROM SALES;
+--------------------------------------+
| (DATE_FORMAT(SALE_DATE, '%D %b %Y')) |
+--------------------------------------+
| 18th May 2007                        |
+--------------------------------------+
1 row in set (0.00 sec)

mysql> SELECT CURRENT_DATE(), CURRENT_TIME();
+----------------+----------------+
| CURRENT_DATE() | CURRENT_TIME() |
+----------------+----------------+
| 2021-04-10     | 23:24:02       |
+----------------+----------------+
1 row in set (0.00 sec)

mysql> SELECT * FROM EMPLOYEE;
+---------+-----------+------------+-----------+------------+---------------+---------------+-----------+-----------+
| EMP_NUM | EMP_TITLE | EMP_LNAME  | EMP_FNAME | EMP_DOB    | EMP_HIRE_DATE | EMP_AREA_CODE | EMP_PHONE | PARK_CODE |
+---------+-----------+------------+-----------+------------+---------------+---------------+-----------+-----------+
|     100 | Ms        | Calderdale | Emma      | 1972-06-15 | 1992-03-15    | 0181          | 324-9134  | FR1001    |
|     101 | Ms        | Ricardo    | Marshel   | 1978-03-19 | 1996-04-25    | 0181          | 324-4472  | UK3452    |
|     102 | Mr        | Arshad     | Arif      | 1969-11-14 | 1990-12-20    | 7253          | 675-8993  | FR1001    |
|     103 | Ms        | Roberts    | Anne      | 1974-10-16 | 1994-08-16    | 0181          | 898-3456  | UK3452    |
|     104 | Mr        | Denver     | Enrica    | 1980-11-08 | 2001-10-20    | 7253          | 504-4434  | ZA1342    |
|     105 | Ms        | Namowa     | Mirrelle  | 1990-03-14 | 2006-11-08    | 0181          | 890-3243  | FR1001    |
|     106 | Mrs       | Smith      | Gemma     | 1968-02-12 | 1989-01-05    | 0181          | 324-7845  | ZA1342    |
+---------+-----------+------------+-----------+------------+---------------+---------------+-----------+-----------+
7 rows in set (0.00 sec)

mysql> SELECT EMP_FNAME,EMP_FNAME,EMP_DOB, 
    -> DATE_FORMAT(EMP_DOB, '%B') AS MONTH 
    -> FROM EMPLOYEE 
    -> WHERE MONTH(EMP_DOB) ='11';
+-----------+-----------+------------+-------+
| EMP_FNAME | EMP_FNAME | EMP_DOB    | MONTH |
+-----------+-----------+------------+-------+
| Arif      | Arif      | 1969-11-14 | B     |
| Enrica    | Enrica    | 1980-11-08 | B     |
+-----------+-----------+------------+-------+
2 rows in set (0.02 sec)

mysql> SELECT DATEDIFF(‘2008-12-25’,‘2008-01-01’);
ERROR 1054 (42S22): Unknown column '‘2008' in 'field list'
mysql> SELECT DATEDIFF(‘2008-12-25’,'2008-01-01');
ERROR 1054 (42S22): Unknown column '‘2008' in 'field list'
mysql> SELECT DATEDIFF('2008-12-25','2008-01-01');
+-------------------------------------+
| DATEDIFF('2008-12-25','2008-01-01') |
+-------------------------------------+
|                                 359 |
+-------------------------------------+
1 row in set (0.00 sec)

mysql> SELECT DATEDIFF('2021-04-10','2009-12-25');
+-------------------------------------+
| DATEDIFF('2021-04-10','2009-12-25') |
+-------------------------------------+
|                                4124 |
+-------------------------------------+
1 row in set (0.00 sec)

mysql> SELECT EMP_LNAME, EMP_FNAME, EMP_HIRE_DATE,
    -> ADDDATE(EMP_HIRE_DATE, INTERVAL 12 MONTH )AS “FIRST APPRAISAL”
    -> FROM EMPLOYEE;
ERROR 1064 (42000): You have an error in your SQL syntax; check the manual that corresponds to your MySQL server version for the right syntax to use near 'APPRAISAL”
FROM EMPLOYEE' at line 2
mysql> SELECT EMP_LNAME, EMP_FNAME, EMP_HIRE_DATE, ADDDATE(EMP_HIRE_DATE, INTERVAL 12 MONTH )AS 'FIRST APPRAISAL' FROM EMPLOYEE;
+------------+-----------+---------------+-----------------+
| EMP_LNAME  | EMP_FNAME | EMP_HIRE_DATE | FIRST APPRAISAL |
+------------+-----------+---------------+-----------------+
| Calderdale | Emma      | 1992-03-15    | 1993-03-15      |
| Ricardo    | Marshel   | 1996-04-25    | 1997-04-25      |
| Arshad     | Arif      | 1990-12-20    | 1991-12-20      |
| Roberts    | Anne      | 1994-08-16    | 1995-08-16      |
| Denver     | Enrica    | 2001-10-20    | 2002-10-20      |
| Namowa     | Mirrelle  | 2006-11-08    | 2007-11-08      |
| Smith      | Gemma     | 1989-01-05    | 1990-01-05      |
+------------+-----------+---------------+-----------------+
7 rows in set (0.02 sec)

mysql> SELECT *
    -> FROM SALES
    -> WHERE SALE_DATE >= LAST_DAY(SALE_DATE)-20;
+----------------+-----------+------------+
| TRANSACTION_NO | PARK_CODE | SALE_DATE  |
+----------------+-----------+------------+
|          12781 | FR1001    | 2007-05-18 |
|          12782 | FR1001    | 2007-05-18 |
|          12783 | FR1001    | 2007-05-18 |
|          12784 | FR1001    | 2007-05-18 |
|          12785 | FR1001    | 2007-05-18 |
|          12786 | FR1001    | 2007-05-18 |
|          34534 | UK3452    | 2007-05-18 |
|          34535 | UK3452    | 2007-05-18 |
|          34536 | UK3452    | 2007-05-18 |
|          34537 | UK3452    | 2007-05-18 |
|          34538 | UK3452    | 2007-05-18 |
|          34539 | UK3452    | 2007-05-18 |
|          34540 | UK3452    | 2007-05-18 |
|          34541 | UK3452    | 2007-05-18 |
|          67589 | ZA1342    | 2007-05-18 |
|          67590 | ZA1342    | 2007-05-18 |
|          67591 | ZA1342    | 2007-05-18 |
|          67592 | ZA1342    | 2007-05-18 |
|          67593 | ZA1342    | 2007-05-18 |
+----------------+-----------+------------+
19 rows in set (0.05 sec)

mysql> SELECT TRANSACTION_NO, LINE_PRICE, MOD(LINE_PRICE, 10)
    -> FROM SALES_LINE
    -> WHERE LINE_QTY > 2;
+----------------+------------+---------------------+
| TRANSACTION_NO | LINE_PRICE | MOD(LINE_PRICE, 10) |
+----------------+------------+---------------------+
|          12785 |     139.96 |                9.96 |
|          34534 |     168.40 |                8.40 |
|          34540 |     168.40 |                8.40 |
|          67592 |     114.68 |                4.68 |
+----------------+------------+---------------------+
4 rows in set (0.06 sec)

mysql> SELECT CONCAT(EMP_LNAME ,EMP_FNAME) AS
    -> NAME FROM EMPLOYEE;
+----------------+
| NAME           |
+----------------+
| CalderdaleEmma |
| RicardoMarshel |
| ArshadArif     |
| RobertsAnne    |
| DenverEnrica   |
| NamowaMirrelle |
| SmithGemma     |
+----------------+
7 rows in set (0.04 sec)

mysql> SELECT CONCAT(UPPER(EMP_LNAME),LOWER(EMP_FNAME)) AS
    -> NAME FROM EMPLOYEE;
+----------------+
| NAME           |
+----------------+
| CALDERDALEemma |
| RICARDOmarshel |
| ARSHADarif     |
| ROBERTSanne    |
| DENVERenrica   |
| NAMOWAmirrelle |
| SMITHgemma     |
+----------------+
7 rows in set (0.02 sec)

mysql> SELECT EMP_PHONE, SUBSTR(EMP_FNAME,1,3)
    -> FROM EMPLOYEE;
+-----------+-----------------------+
| EMP_PHONE | SUBSTR(EMP_FNAME,1,3) |
+-----------+-----------------------+
| 324-9134  | Emm                   |
| 324-4472  | Mar                   |
| 675-8993  | Ari                   |
| 898-3456  | Ann                   |
| 504-4434  | Enr                   |
| 890-3243  | Mir                   |
| 324-7845  | Gem                   |
+-----------+-----------------------+
7 rows in set (0.00 sec)

mysql> SELECT ATTRACT_NAME, LENGTH(ATTRACT_NAME) AS
    -> NAMESIZE FROM ATTRACTION
    -> ORDER BY NAMESIZE DESC;
+-----------------+----------+
| ATTRACT_NAME    | NAMESIZE |
+-----------------+----------+
| SpinningTeacups |       15 |
| ThunderCoaster  |       14 |
| FlightToStars   |       13 |
| 3D-Lego_Show    |       12 |
| UnderSeaWord    |       12 |
| BlackHole2      |       10 |
| Ant-Trap        |        8 |
| Carnival        |        8 |
| GoldRush        |        8 |
| Pirates         |        7 |
| NULL            |     NULL |
+-----------------+----------+
11 rows in set (0.06 sec)

mysql> SELECT 10, CAST(10 AS CHAR);
+----+------------------+
| 10 | CAST(10 AS CHAR) |
+----+------------------+
| 10 | 10               |
+----+------------------+
1 row in set (0.02 sec)

mysql> SELECT PARK_CODE, PARK_COUNTRY, (CASE PARK_COUNTRY WHEN 'UK'
    -> THEN 'United Kingdom' WHEN 'FR' THEN 'France' WHEN 'NL' THEN 'The
    '> Netherlands' WHEN 'SP' THEN 'Spain' WHEN 'ZA' THEN 'South Africa' WHEN 'SW'
    -> THEN 'Switzerland' ELSE' Unknown' END) AS COUNTRY
    -> FROM THEMEPARK;
+-----------+--------------+-----------------+
| PARK_CODE | PARK_COUNTRY | COUNTRY         |
+-----------+--------------+-----------------+
| FR1001    | FR           | France          |
| NL1202    | NL           | The
Netherlands |
| SP4533    | SP           | Spain           |
| SW2323    | SW           | Switzerland     |
| UK2622    | UK           | United Kingdom  |
| UK3452    | UK           | United Kingdom  |
| ZA1342    | ZA           | South Africa    |
+-----------+--------------+-----------------+
7 rows in set (0.03 sec)

mysql> IF-THEN-ELSE statement:
    -> IF PARK_COUNTRY = ‘UK’ THEN
    -> result := 'United Kingdom';
ERROR 1064 (42000): You have an error in your SQL syntax; check the manual that corresponds to your MySQL server version for the right syntax to use near 'IF-THEN-ELSE statement:
IF PARK_COUNTRY = ‘UK’ THEN
result := 'United Kingdo' at line 1
mysql> ELSIF PARK_COUNTRY = ‘FR’ THEN
    -> result := 'FRANCE';
ERROR 1064 (42000): You have an error in your SQL syntax; check the manual that corresponds to your MySQL server version for the right syntax to use near 'ELSIF PARK_COUNTRY = ‘FR’ THEN
result := 'FRANCE'' at line 1
mysql> ELSIF PARK_COUNTRY = ‘NL’ THEN
    -> result := 'The Netherlands';
ERROR 1064 (42000): You have an error in your SQL syntax; check the manual that corresponds to your MySQL server version for the right syntax to use near 'ELSIF PARK_COUNTRY = ‘NL’ THEN
result := 'The Netherlands'' at line 1
mysql> ELSIF PARK_COUNTRY = ‘SP’ THEN
    -> result := 'Spain';
ERROR 1064 (42000): You have an error in your SQL syntax; check the manual that corresponds to your MySQL server version for the right syntax to use near 'ELSIF PARK_COUNTRY = ‘SP’ THEN
result := 'Spain'' at line 1
mysql> ELSIF PARK_COUNTRY = ‘ZA’ THEN
    -> result := 'South Africa';
ERROR 1064 (42000): You have an error in your SQL syntax; check the manual that corresponds to your MySQL server version for the right syntax to use near 'ELSIF PARK_COUNTRY = ‘ZA’ THEN
result := 'South Africa'' at line 1
mysql> ELSIF PARK_COUNTRY = ‘SW’ THEN
    -> result := 'Switzerland';
ERROR 1064 (42000): You have an error in your SQL syntax; check the manual that corresponds to your MySQL server version for the right syntax to use near 'ELSIF PARK_COUNTRY = ‘SW’ THEN
result := 'Switzerland'' at line 1
mysql> ELSE
    -> result := 'Unknown’;
    '> END IF;CDS 
    '> ;
    '> 
    '> 
[1]  + 10595 suspended  sudo mysql
☁  ~ [master] ⚡  sudo mysql
[sudo] password for home: 
Welcome to the MySQL monitor.  Commands end with ; or \g.
Your MySQL connection id is 9
Server version: 8.0.23-0ubuntu0.20.10.1 (Ubuntu)

Copyright (c) 2000, 2021, Oracle and/or its affiliates.

Oracle is a registered trademark of Oracle Corporation and/or its
affiliates. Other names may be trademarks of their respective
owners.

Type 'help;' or '\h' for help. Type '\c' to clear the current input statement.

mysql> use themepark;
Reading table information for completion of table and column names
You can turn off this feature to get a quicker startup with -A

Database changed
mysql> CREATE VIEW EMPFR AS SELECT * FROM 
    -> EMPLOYEE 
    -> WHERE EMP_NO = 'FR1001';
ERROR 1054 (42S22): Unknown column 'EMP_NO' in 'where clause'
mysql> SELECT * FROM EMPLOYEE;
+---------+-----------+------------+-----------+------------+---------------+---------------+-----------+-----------+
| EMP_NUM | EMP_TITLE | EMP_LNAME  | EMP_FNAME | EMP_DOB    | EMP_HIRE_DATE | EMP_AREA_CODE | EMP_PHONE | PARK_CODE |
+---------+-----------+------------+-----------+------------+---------------+---------------+-----------+-----------+
|     100 | Ms        | Calderdale | Emma      | 1972-06-15 | 1992-03-15    | 0181          | 324-9134  | FR1001    |
|     101 | Ms        | Ricardo    | Marshel   | 1978-03-19 | 1996-04-25    | 0181          | 324-4472  | UK3452    |
|     102 | Mr        | Arshad     | Arif      | 1969-11-14 | 1990-12-20    | 7253          | 675-8993  | FR1001    |
|     103 | Ms        | Roberts    | Anne      | 1974-10-16 | 1994-08-16    | 0181          | 898-3456  | UK3452    |
|     104 | Mr        | Denver     | Enrica    | 1980-11-08 | 2001-10-20    | 7253          | 504-4434  | ZA1342    |
|     105 | Ms        | Namowa     | Mirrelle  | 1990-03-14 | 2006-11-08    | 0181          | 890-3243  | FR1001    |
|     106 | Mrs       | Smith      | Gemma     | 1968-02-12 | 1989-01-05    | 0181          | 324-7845  | ZA1342    |
+---------+-----------+------------+-----------+------------+---------------+---------------+-----------+-----------+
7 rows in set (0.00 sec)

mysql> SELECT * FROM  EMPLOYEE  WHERE EMP_NO = 'FR1001';
ERROR 1054 (42S22): Unknown column 'EMP_NO' in 'where clause'
mysql> SELECT *FROM EMPLOYEE
    -> WHERE EMP_NUM='101';
+---------+-----------+-----------+-----------+------------+---------------+---------------+-----------+-----------+
| EMP_NUM | EMP_TITLE | EMP_LNAME | EMP_FNAME | EMP_DOB    | EMP_HIRE_DATE | EMP_AREA_CODE | EMP_PHONE | PARK_CODE |
+---------+-----------+-----------+-----------+------------+---------------+---------------+-----------+-----------+
|     101 | Ms        | Ricardo   | Marshel   | 1978-03-19 | 1996-04-25    | 0181          | 324-4472  | UK3452    |
+---------+-----------+-----------+-----------+------------+---------------+---------------+-----------+-----------+
1 row in set (0.00 sec)

mysql> CREATE VIEW EMPFR ASD SELECT *FROM EMPLOYEE 
    -> WHERE EMP_NUM='101';
ERROR 1064 (42000): You have an error in your SQL syntax; check the manual that corresponds to your MySQL server version for the right syntax to use near 'ASD SELECT *FROM EMPLOYEE 
WHERE EMP_NUM='101'' at line 1
mysql> CREATE VIEW EMPFR ASD SELECT *FROM EMPLOYEE  WHERE EMP_NUM='101CREATE VIEW EMP_WORKED AS  SELECT EMP_LNAME,EMP_FNAME, ATTRACT_NO,DATE_WORKED  FROM EMPLOYEE E NATURAL JOIN HOURS H WHERE  E.EMP_NUM = H.EMP_NUM;';
ERROR 1064 (42000): You have an error in your SQL syntax; check the manual that corresponds to your MySQL server version for the right syntax to use near 'ASD SELECT *FROM EMPLOYEE  WHERE EMP_NUM='101CREATE VIEW EMP_WORKED AS  SELECT E' at line 1
mysql> CREATE VIEW EMP_WORKED AS  SELECT EMP_LNAME,EMP_FNAME, ATTRACT_NO,DATE_WORKED  FROM EMPLOYEE E NATURAL JOIN HOURS H WHERE  E.EMP_NUM = H.EMP_NUM;
Query OK, 0 rows affected (0.25 sec)

mysql> SELECT * FROM EMP_WORKED;
+------------+-----------+------------+-------------+
| EMP_LNAME  | EMP_FNAME | ATTRACT_NO | DATE_WORKED |
+------------+-----------+------------+-------------+
| Calderdale | Emma      |      10034 | 2007-05-18  |
| Calderdale | Emma      |      10034 | 2007-05-20  |
| Ricardo    | Marshel   |      10034 | 2007-05-18  |
| Arshad     | Arif      |      30012 | 2007-05-23  |
| Arshad     | Arif      |      30044 | 2007-05-21  |
| Arshad     | Arif      |      30044 | 2007-05-22  |
| Denver     | Enrica    |      30011 | 2007-05-21  |
| Denver     | Enrica    |      30012 | 2007-05-22  |
| Namowa     | Mirrelle  |      10078 | 2007-05-18  |
| Namowa     | Mirrelle  |      10098 | 2007-05-18  |
| Namowa     | Mirrelle  |      10098 | 2007-05-19  |
+------------+-----------+------------+-------------+
11 rows in set (0.00 sec)

mysql> SELECT DAYOFMONTH(EMP_DOB) AS "Day", MONTH(EMP_DOB) AS "Month",
    -> YEAR(EMP_DOB) AS "Year"
    -> FROM EMPLOYEE;SELECT DAYOFMONTH(EMP_DOB) AS "Day", MONTH(EMP_DOB) AS "Month",
^C
mysql>     -> YEAR(EMP_DOB) AS "Year"
    -> SELECT PARK_CODE, PARK_NAME, PARK_COUNTRY FROM THEMEPARK WHERE NOT EXISTS (SELECT PARK_CODE FROM SALES WHERE SALES.PARK_CODE = THEMEPARK.PARK_CODE);
ERROR 1064 (42000): You have an error in your SQL syntax; check the manual that corresponds to your MySQL server version for the right syntax to use near '-> YEAR(EMP_DOB) AS "Year"
SELECT PARK_CODE, PARK_NAME, PARK_COUNTRY FROM THEMEP' at line 1
mysql> SELECT DAYOFMONTH(EMP_DOB) AS "Day", MONTH(EMP_DOB) AS "Month",
    ->     -> YEAR(EMP_DOB) AS "Year"
    ->     -> FROM EMPLOYEE;
ERROR 1064 (42000): You have an error in your SQL syntax; check the manual that corresponds to your MySQL server version for the right syntax to use near '-> YEAR(EMP_DOB) AS "Year"
    -> FROM EMPLOYEE' at line 2
mysql> SELECT DAYOFMONTH(EMP_DOB) AS "Day", MONTH(EMP_DOB) AS "Month" YEAR(EMP_DOB) AS "Year"   FROM EMPLOYEE;
ERROR 1064 (42000): You have an error in your SQL syntax; check the manual that corresponds to your MySQL server version for the right syntax to use near 'YEAR(EMP_DOB) AS "Year"   FROM EMPLOYEE' at line 1
mysql> SELECT DAYOFMONTH(EMP_DOB) AS "Day", MONTH(EMP_DOB) AS Month YEAR(EMP_DOB) AS Year   FROM EMPLOYEE;
ERROR 1064 (42000): You have an error in your SQL syntax; check the manual that corresponds to your MySQL server version for the right syntax to use near 'YEAR(EMP_DOB) AS Year   FROM EMPLOYEE' at line 1
mysql> REATE VIEW EMP_WORKED AS  SELECT EMP_LNAME,EMP_FNAME, ATTRACT_NO,DATE_WORKED  FROM EMPLOYEE E NATURAL JOIN HOURS H WHERE  E.EMP_NUM = H.EMP_NUM;
REATE VIEW EMP_WORKED AS  SELECT EMP_LNAME,EMP_FNAME, ATTRACT_NO,DATE_WORKED  FROM EMPLOYEE E NATURAL JOIN HOURS H WHERE  E.EMP_NUM = H.EMP_NUM;
^C
mysql> 
mysql> REATE VIEW EMP_WORKED AS  SELECT EMP_LNAME,EMP_FNAME, ATTRACT_NO,DATE_WORKED  FROM EMPLOYEE E NATURAL JOIN HOURS H WHERE  E.EMP_NUM = H.EMP_NUM;
ERROR 1064 (42000): You have an error in your SQL syntax; check the manual that corresponds to your MySQL server version for the right syntax to use near 'REATE VIEW EMP_WORKED AS  SELECT EMP_LNAME,EMP_FNAME, ATTRACT_NO,DATE_WORKED  FR' at line 1
mysql> REATE VIEW EMP_WORKED AS  SELECT EMP_LNAME,EMP_FNAME, ATTRACT_NO,DATE_WORKED  FROM EMPLOYEE E NATURAL JOIN HOURS H WHERE  E.EMP_NUM = H.EMP_NUM;
ERROR 1064 (42000): You have an error in your SQL syntax; check the manual that corresponds to your MySQL server version for the right syntax to use near 'REATE VIEW EMP_WORKED AS  SELECT EMP_LNAME,EMP_FNAME, ATTRACT_NO,DATE_WORKED  FR' at line 1
mysql>  SELECT * FROM EMP_WORKED;
+------------+-----------+------------+-------------+
| EMP_LNAME  | EMP_FNAME | ATTRACT_NO | DATE_WORKED |
+------------+-----------+------------+-------------+
| Calderdale | Emma      |      10034 | 2007-05-18  |
| Calderdale | Emma      |      10034 | 2007-05-20  |
| Ricardo    | Marshel   |      10034 | 2007-05-18  |
| Arshad     | Arif      |      30012 | 2007-05-23  |
| Arshad     | Arif      |      30044 | 2007-05-21  |
| Arshad     | Arif      |      30044 | 2007-05-22  |
| Denver     | Enrica    |      30011 | 2007-05-21  |
| Denver     | Enrica    |      30012 | 2007-05-22  |
| Namowa     | Mirrelle  |      10078 | 2007-05-18  |
| Namowa     | Mirrelle  |      10098 | 2007-05-18  |
| Namowa     | Mirrelle  |      10098 | 2007-05-19  |
+------------+-----------+------------+-------------+
11 rows in set (0.01 sec)

mysql>  SELECT * FROM EMP_WORKED;
+------------+-----------+------------+-------------+
| EMP_LNAME  | EMP_FNAME | ATTRACT_NO | DATE_WORKED |
+------------+-----------+------------+-------------+
| Calderdale | Emma      |      10034 | 2007-05-18  |
| Calderdale | Emma      |      10034 | 2007-05-20  |
| Ricardo    | Marshel   |      10034 | 2007-05-18  |
| Arshad     | Arif      |      30012 | 2007-05-23  |
| Arshad     | Arif      |      30044 | 2007-05-21  |
| Arshad     | Arif      |      30044 | 2007-05-22  |
| Denver     | Enrica    |      30011 | 2007-05-21  |
| Denver     | Enrica    |      30012 | 2007-05-22  |
| Namowa     | Mirrelle  |      10078 | 2007-05-18  |
| Namowa     | Mirrelle  |      10098 | 2007-05-18  |
| Namowa     | Mirrelle  |      10098 | 2007-05-19  |
+------------+-----------+------------+-------------+
11 rows in set (0.00 sec)

mysql> SELECT EMP_FNAME,EMP_LNAME,CONCAT(SUBSTR(EMP_PHONE,1,3),LOWER(SUBSTR(EMP_FNAME,1,2))) AS USER_PASSWORD   FROM EMPLOYEE;
+-----------+------------+---------------+
| EMP_FNAME | EMP_LNAME  | USER_PASSWORD |
+-----------+------------+---------------+
| Emma      | Calderdale | 324em         |
| Marshel   | Ricardo    | 324ma         |
| Arif      | Arshad     | 675ar         |
| Anne      | Roberts    | 898an         |
| Enrica    | Denver     | 504en         |
| Mirrelle  | Namowa     | 890mi         |
| Gemma     | Smith      | 324ge         |
+-----------+------------+---------------+
7 rows in set (0.00 sec)

mysql> SELECT * FROM EMPLOYEE;
+---------+-----------+------------+-----------+------------+---------------+---------------+-----------+-----------+
| EMP_NUM | EMP_TITLE | EMP_LNAME  | EMP_FNAME | EMP_DOB    | EMP_HIRE_DATE | EMP_AREA_CODE | EMP_PHONE | PARK_CODE |
+---------+-----------+------------+-----------+------------+---------------+---------------+-----------+-----------+
|     100 | Ms        | Calderdale | Emma      | 1972-06-15 | 1992-03-15    | 0181          | 324-9134  | FR1001    |
|     101 | Ms        | Ricardo    | Marshel   | 1978-03-19 | 1996-04-25    | 0181          | 324-4472  | UK3452    |
|     102 | Mr        | Arshad     | Arif      | 1969-11-14 | 1990-12-20    | 7253          | 675-8993  | FR1001    |
|     103 | Ms        | Roberts    | Anne      | 1974-10-16 | 1994-08-16    | 0181          | 898-3456  | UK3452    |
|     104 | Mr        | Denver     | Enrica    | 1980-11-08 | 2001-10-20    | 7253          | 504-4434  | ZA1342    |
|     105 | Ms        | Namowa     | Mirrelle  | 1990-03-14 | 2006-11-08    | 0181          | 890-3243  | FR1001    |
|     106 | Mrs       | Smith      | Gemma     | 1968-02-12 | 1989-01-05    | 0181          | 324-7845  | ZA1342    |
+---------+-----------+------------+-----------+------------+---------------+---------------+-----------+-----------+
7 rows in set (0.00 sec)

mysql> SELECT EMP_FNAME,EMP_DOB FROM EMPLOYEE
    -> WHERE DAY(EMP_DOB) ='14';
+-----------+------------+
| EMP_FNAME | EMP_DOB    |
+-----------+------------+
| Arif      | 1969-11-14 |
| Mirrelle  | 1990-03-14 |
+-----------+------------+
2 rows in set (0.00 sec)

mysql> SELECT EMP_FNAME,EMP_LNAME,CONCAT(DATE_FORMAT(EMP_DOB,'%m01'),UPPER(SUBSTR(EMP_LNAME,1,6))) AS USER_ID FROM EMPLOYEE;
+-----------+------------+------------+
| EMP_FNAME | EMP_LNAME  | USER_ID    |
+-----------+------------+------------+
| Emma      | Calderdale | 0601CALDER |
| Marshel   | Ricardo    | 0301RICARD |
| Arif      | Arshad     | 1101ARSHAD |
| Anne      | Roberts    | 1001ROBERT |
| Enrica    | Denver     | 1101DENVER |
| Mirrelle  | Namowa     | 0301NAMOWA |
| Gemma     | Smith      | 0201SMITH  |
+-----------+------------+------------+
7 rows in set (0.00 sec)

mysql> SELECT DISTICNT (DATE_FORMAT(SALE_DATE, '%a-%d-%c-%y')) FROM SALES
    -> ;
ERROR 1305 (42000): FUNCTION themepark.DISTICNT does not exist
mysql> SELECT DISTINCTT (DATE_FORMAT(SALE_DATE, '%a-%d-%c-%y')) FROM SALES
    -> ;
ERROR 1305 (42000): FUNCTION themepark.DISTINCTT does not exist
mysql> SELECT DISTINCT (DATE_FORMAT(SALE_DATE, '%a-%d-%c-%y')) FROM SALES;
+-----------------------------------------+
| (DATE_FORMAT(SALE_DATE, '%a-%d-%c-%y')) |
+-----------------------------------------+
| Fri-18-5-07                             |
+-----------------------------------------+
1 row in set (0.02 sec)

mysql> CREATE VIEW EMP_WORKED AS  SELECT EMP_LNAME,EMP_FNAME, ATTRACT_NO,DATE_WORKED  FROM EMPLOYEE E NATURAL JOIN HOURS H WHERE  E.EMP_NUM = H.EMP_NUM;
ERROR 1050 (42S01): Table 'EMP_WORKED' already exists
mysql> SELECT * FROM EMP_WORKED;
+------------+-----------+------------+-------------+
| EMP_LNAME  | EMP_FNAME | ATTRACT_NO | DATE_WORKED |
+------------+-----------+------------+-------------+
| Calderdale | Emma      |      10034 | 2007-05-18  |
| Calderdale | Emma      |      10034 | 2007-05-20  |
| Ricardo    | Marshel   |      10034 | 2007-05-18  |
| Arshad     | Arif      |      30012 | 2007-05-23  |
| Arshad     | Arif      |      30044 | 2007-05-21  |
| Arshad     | Arif      |      30044 | 2007-05-22  |
| Denver     | Enrica    |      30011 | 2007-05-21  |
| Denver     | Enrica    |      30012 | 2007-05-22  |
| Namowa     | Mirrelle  |      10078 | 2007-05-18  |
| Namowa     | Mirrelle  |      10098 | 2007-05-18  |
| Namowa     | Mirrelle  |      10098 | 2007-05-19  |
+------------+-----------+------------+-------------+
11 rows in set (0.00 sec)

mysql> UPDATE VIEW EMP_WORKED 
UPDATE VIEW EMP_WORKED
^C
mysql> SELECT * FROM EMP_WORKED
    -> FROM THEMEPARK
    -> WHERE EMP_NUM ='101';
ERROR 1064 (42000): You have an error in your SQL syntax; check the manual that corresponds to your MySQL server version for the right syntax to use near 'FROM THEMEPARK
WHERE EMP_NUM ='101'' at line 2
mysql> SELECT * FROM EMP_WORKED FROM THEMEPARK WHERE EMP_NUM ='103';
ERROR 1064 (42000): You have an error in your SQL syntax; check the manual that corresponds to your MySQL server version for the right syntax to use near 'FROM THEMEPARK WHERE EMP_NUM ='103'' at line 1
mysql> SELECT * FROM EMP_WORKED FROM THEMEPARK WHERE EMP_NUM ='105';
ERROR 1064 (42000): You have an error in your SQL syntax; check the manual that corresponds to your MySQL server version for the right syntax to use near 'FROM THEMEPARK WHERE EMP_NUM ='105'' at line 1
mysql> SELECT * FROM EMP_WORKED FROM EMPLOYEE WHERE EMP_NUM ='105';
ERROR 1064 (42000): You have an error in your SQL syntax; check the manual that corresponds to your MySQL server version for the right syntax to use near 'FROM EMPLOYEE WHERE EMP_NUM ='105'' at line 1
mysql> UPDATE VIEW EMPFR  SET PARK_CODE 'UK3452' WHERE EMP_NUM =102;
ERROR 1064 (42000): You have an error in your SQL syntax; check the manual that corresponds to your MySQL server version for the right syntax to use near ''UK3452' WHERE EMP_NUM =102' at line 1
mysql> 
mysql> 
mysql> 
mysql> 
mysql> 
mysql> 
mysql> 
mysql> 
mysql> UPDATE EMPFR
    -> SET PARK_CODE = 'UK3452'
    -> WHERE EMP_NUM = 100;
Query OK, 1 row affected (0.20 sec)
Rows matched: 1  Changed: 1  Warnings: 0

mysql> SELECT * FROM 
[2]  + 14299 suspended  sudo mysql
☁  ~ [master] ⚡  sudo mysql
[sudo] password for home: 
Welcome to the MySQL monitor.  Commands end with ; or \g.
Your MySQL connection id is 12
Server version: 8.0.23-0ubuntu0.20.10.1 (Ubuntu)

Copyright (c) 2000, 2021, Oracle and/or its affiliates.

Oracle is a registered trademark of Oracle Corporation and/or its
affiliates. Other names may be trademarks of their respective
owners.

Type 'help;' or '\h' for help. Type '\c' to clear the current input statement.

mysql> use thempark;
ERROR 1049 (42000): Unknown database 'thempark'
mysql> use themeparl
ERROR 1049 (42000): Unknown database 'themeparl'
mysql> use themepark
Reading table information for completion of table and column names
You can turn off this feature to get a quicker startup with -A

Database changed
mysql> SELECT * FROM EMPFR;
+---------+-----------+-----------+-----------+------------+---------------+---------------+-----------+-----------+
| EMP_NUM | EMP_TITLE | EMP_LNAME | EMP_FNAME | EMP_DOB    | EMP_HIRE_DATE | EMP_AREA_CODE | EMP_PHONE | PARK_CODE |
+---------+-----------+-----------+-----------+------------+---------------+---------------+-----------+-----------+
|     102 | Mr        | Arshad    | Arif      | 1969-11-14 | 1990-12-20    | 7253          | 675-8993  | FR1001    |
|     105 | Ms        | Namowa    | Mirrelle  | 1990-03-14 | 2006-11-08    | 0181          | 890-3243  | FR1001    |
+---------+-----------+-----------+-----------+------------+---------------+---------------+-----------+-----------+
2 rows in set (0.00 sec)

mysql> EMPFRUPDATE EMPFR
    -> SET PARK_CODE = 'UK3452'
    -> 
    -> ;
ERROR 1064 (42000): You have an error in your SQL syntax; check the manual that corresponds to your MySQL server version for the right syntax to use near 'EMPFRUPDATE EMPFR
SET PARK_CODE = 'UK3452'' at line 1
mysql> UPDATE EMPFR
    -> SET PARK_CODE = 'UK3452'
    -> WHERE EMP_NUM = 100;
Query OK, 0 rows affected (0.00 sec)
Rows matched: 0  Changed: 0  Warnings: 0

mysql> UPDATE EMPFR
    -> SET PARK_CODE = 'UK3452'
    -> WHERE EMP_NUM = 100;
Query OK, 0 rows affected (0.00 sec)
Rows matched: 0  Changed: 0  Warnings: 0

mysql> SELECT * FROM EMPFR;
+---------+-----------+-----------+-----------+------------+---------------+---------------+-----------+-----------+
| EMP_NUM | EMP_TITLE | EMP_LNAME | EMP_FNAME | EMP_DOB    | EMP_HIRE_DATE | EMP_AREA_CODE | EMP_PHONE | PARK_CODE |
+---------+-----------+-----------+-----------+------------+---------------+---------------+-----------+-----------+
|     102 | Mr        | Arshad    | Arif      | 1969-11-14 | 1990-12-20    | 7253          | 675-8993  | FR1001    |
|     105 | Ms        | Namowa    | Mirrelle  | 1990-03-14 | 2006-11-08    | 0181          | 890-3243  | FR1001    |
+---------+-----------+-----------+-----------+------------+---------------+---------------+-----------+-----------+
2 rows in set (0.00 sec)

mysql> UPDATE EMPFR SET EMP_PHONE ='324-9652'
UPDATE EMPFR SET EMP_PHONE ='324-9652'
^C
mysql> UPDATE EMPFR SET PARK_CODE = 'UK3452' WHERE EMP_NUM = 100;
Query OK, 0 rows affected (0.00 sec)
Rows matched: 0  Changed: 0  Warnings: 0

mysql> UPDATE EMPFR SET EMP_PHONE ='324-9652' WHERE EMP_NO = 100;
ERROR 1054 (42S22): Unknown column 'EMP_NO' in 'where clause'
mysql> update empfr set emp_phone ='324-9652' where emp_num = 100;
ERROR 1146 (42S02): Table 'themepark.empfr' doesn't exist
mysql> UPDATE *FROM EMPFR;
ERROR 1064 (42000): You have an error in your SQL syntax; check the manual that corresponds to your MySQL server version for the right syntax to use near '*FROM EMPFR' at line 1
mysql> SELECT * FROM EMPFR;
+---------+-----------+-----------+-----------+------------+---------------+---------------+-----------+-----------+
| EMP_NUM | EMP_TITLE | EMP_LNAME | EMP_FNAME | EMP_DOB    | EMP_HIRE_DATE | EMP_AREA_CODE | EMP_PHONE | PARK_CODE |
+---------+-----------+-----------+-----------+------------+---------------+---------------+-----------+-----------+
|     102 | Mr        | Arshad    | Arif      | 1969-11-14 | 1990-12-20    | 7253          | 675-8993  | FR1001    |
|     105 | Ms        | Namowa    | Mirrelle  | 1990-03-14 | 2006-11-08    | 0181          | 890-3243  | FR1001    |
+---------+-----------+-----------+-----------+------------+---------------+---------------+-----------+-----------+
2 rows in set (0.00 sec)

mysql> update empfr set emp_phone ='324-9652' where emp_num = 102;
ERROR 1146 (42S02): Table 'themepark.empfr' doesn't exist
mysql> UPDATE EMPFR SET EMP_PHONE ='324-9652' WHERE EMP_NO = 102;
ERROR 1054 (42S22): Unknown column 'EMP_NO' in 'where clause'
mysql> 
mysql> 
mysql> 
mysql> 
mysql> 
mysql> 
mysql> 
mysql> 
mysql> 
mysql> 
mysql> 
mysql> 
mysql> 
mysql> 
mysql> 
mysql> 
mysql> 
mysql> 
mysql> 
mysql> 
mysql> 
mysql> 
mysql> 
mysql> 
mysql> 
mysql> 
mysql> 
mysql> 
mysql> 
mysql> 
mysql> 
mysql> 
mysql> 
mysql> 
mysql> 
mysql> 
mysql> UPDATE EMPFR SET EMP_PHONE ='324-9652' WHERE EMP_NUM=100;
Query OK, 0 rows affected (0.00 sec)
Rows matched: 0  Changed: 0  Warnings: 0

mysql> SELECT * FROM EMPLOYEE;
+---------+-----------+------------+-----------+------------+---------------+---------------+-----------+-----------+
| EMP_NUM | EMP_TITLE | EMP_LNAME  | EMP_FNAME | EMP_DOB    | EMP_HIRE_DATE | EMP_AREA_CODE | EMP_PHONE | PARK_CODE |
+---------+-----------+------------+-----------+------------+---------------+---------------+-----------+-----------+
|     100 | Ms        | Calderdale | Emma      | 1972-06-15 | 1992-03-15    | 0181          | 324-9134  | UK3452    |
|     101 | Ms        | Ricardo    | Marshel   | 1978-03-19 | 1996-04-25    | 0181          | 324-4472  | UK3452    |
|     102 | Mr        | Arshad     | Arif      | 1969-11-14 | 1990-12-20    | 7253          | 675-8993  | FR1001    |
|     103 | Ms        | Roberts    | Anne      | 1974-10-16 | 1994-08-16    | 0181          | 898-3456  | UK3452    |
|     104 | Mr        | Denver     | Enrica    | 1980-11-08 | 2001-10-20    | 7253          | 504-4434  | ZA1342    |
|     105 | Ms        | Namowa     | Mirrelle  | 1990-03-14 | 2006-11-08    | 0181          | 890-3243  | FR1001    |
|     106 | Mrs       | Smith      | Gemma     | 1968-02-12 | 1989-01-05    | 0181          | 324-7845  | ZA1342    |
+---------+-----------+------------+-----------+------------+---------------+---------------+-----------+-----------+
7 rows in set (0.01 sec)

mysql> DROP VIEW EMPFR;
Query OK, 0 rows affected (0.15 sec)

mysql> 
mysql> 
mysql> 
mysql> 
mysql> 
mysql> 
mysql> 
mysql> 
mysql> 
mysql> 
mysql> 
mysql> 
mysql> 
mysql> 
mysql> 
mysql> 
mysql> 
mysql> 
mysql> 
mysql> 
mysql> 
mysql> 
mysql> 
mysql> SELECT * FROM TICKETL
    -> 
    -> 
    -> ;
ERROR 1146 (42S02): Table 'themepark.TICKETL' doesn't exist
mysql> SELECT * FROM TICKET;
+-----------+--------------+-------------+-----------+
| TICKET_NO | TICKET_PRICE | TICKET_TYPE | PARK_CODE |
+-----------+--------------+-------------+-----------+
|     11001 |        24.99 | Adult       | SP4533    |
|     11002 |        14.99 | Child       | SP4533    |
|     11003 |        10.99 | Senior      | SP4533    |
|     13001 |        18.99 | Child       | FR1001    |
|     13002 |        34.99 | Adult       | FR1001    |
|     13003 |        20.99 | Senior      | FR1001    |
|     67832 |        18.56 | Child       | ZA1342    |
|     67833 |        28.67 | Adult       | ZA1342    |
|     67855 |        12.12 | Senior      | ZA1342    |
|     88567 |        22.50 | Child       | UK3452    |
|     88568 |        42.10 | Adult       | UK3452    |
|     89720 |        10.99 | Senior      | UK3452    |
+-----------+--------------+-------------+-----------+
12 rows in set (0.02 sec)

mysql> SHOW TABLES;
+---------------------+
| Tables_in_themepark |
+---------------------+
| ATTRACTION          |
| EMPLOYEE            |
| EMP_WORKED          |
| HOURS               |
| SALES               |
| SALES_LINE          |
| THEMEPARK           |
| TICKET              |
+---------------------+
8 rows in set (0.01 sec)

mysql> DESCRIBE ATTRACION;
ERROR 1146 (42S02): Table 'themepark.ATTRACION' doesn't exist
mysql> DESCRIBE SALES;
+----------------+---------------+------+-----+---------+-------+
| Field          | Type          | Null | Key | Default | Extra |
+----------------+---------------+------+-----+---------+-------+
| TRANSACTION_NO | decimal(10,0) | NO   | PRI | NULL    |       |
| PARK_CODE      | varchar(10)   | YES  | MUL | NULL    |       |
| SALE_DATE      | date          | NO   |     | NULL    |       |
+----------------+---------------+------+-----+---------+-------+
3 rows in set (0.09 sec)

mysql> SELECT * FROM SALES;             
SELECT * FROM SALES;
^C
mysql> SELECT * FROM SALES;
+----------------+-----------+------------+
| TRANSACTION_NO | PARK_CODE | SALE_DATE  |
+----------------+-----------+------------+
|          12781 | FR1001    | 2007-05-18 |
|          12782 | FR1001    | 2007-05-18 |
|          12783 | FR1001    | 2007-05-18 |
|          12784 | FR1001    | 2007-05-18 |
|          12785 | FR1001    | 2007-05-18 |
|          12786 | FR1001    | 2007-05-18 |
|          34534 | UK3452    | 2007-05-18 |
|          34535 | UK3452    | 2007-05-18 |
|          34536 | UK3452    | 2007-05-18 |
|          34537 | UK3452    | 2007-05-18 |
|          34538 | UK3452    | 2007-05-18 |
|          34539 | UK3452    | 2007-05-18 |
|          34540 | UK3452    | 2007-05-18 |
|          34541 | UK3452    | 2007-05-18 |
|          67589 | ZA1342    | 2007-05-18 |
|          67590 | ZA1342    | 2007-05-18 |
|          67591 | ZA1342    | 2007-05-18 |
|          67592 | ZA1342    | 2007-05-18 |
|          67593 | ZA1342    | 2007-05-18 |
+----------------+-----------+------------+
19 rows in set (0.00 sec)

mysql> SELECT * FROM SALES
[3]  + 17900 suspended  sudo mysql
sudo mysql
[sudo] password for home: 
Welcome to the MySQL monitor.  Commands end with ; or \g.
Your MySQL connection id is 13
Server version: 8.0.23-0ubuntu0.20.10.1 (Ubuntu)

Copyright (c) 2000, 2021, Oracle and/or its affiliates.

Oracle is a registered trademark of Oracle Corporation and/or its
affiliates. Other names may be trademarks of their respective
owners.

Type 'help;' or '\h' for help. Type '\c' to clear the current input statement.

mysql> use themepark
Reading table information for completion of table and column names
You can turn off this feature to get a quicker startup with -A

Database changed
mysql> SELECT * FROM SALES_LINE;
+----------------+---------+-----------+----------+------------+
| TRANSACTION_NO | LINE_NO | TICKET_NO | LINE_QTY | LINE_PRICE |
+----------------+---------+-----------+----------+------------+
|          12781 |       1 |     13002 |        2 |      69.98 |
|          12781 |       2 |     13001 |        1 |      14.99 |
|          12782 |       1 |     13002 |        2 |      69.98 |
|          12783 |       1 |     13003 |        2 |      41.98 |
|          12784 |       2 |     13001 |        1 |      14.99 |
|          12785 |       1 |     13001 |        1 |      14.99 |
|          12785 |       2 |     13002 |        1 |      34.99 |
|          12785 |       3 |     13002 |        4 |     139.96 |
|          34534 |       1 |     88568 |        4 |     168.40 |
|          34534 |       2 |     88567 |        1 |      22.50 |
|          34534 |       3 |     89720 |        2 |      21.98 |
|          34535 |       1 |     88568 |        2 |      84.20 |
|          34536 |       1 |     89720 |        2 |      21.98 |
|          34537 |       1 |     88568 |        2 |      84.20 |
|          34537 |       2 |     88567 |        1 |      22.50 |
|          34538 |       1 |     89720 |        2 |      21.98 |
|          34539 |       1 |     89720 |        2 |      21.98 |
|          34539 |       2 |     88568 |        2 |      84.20 |
|          34540 |       1 |     88568 |        4 |     168.40 |
|          34540 |       2 |     88567 |        1 |      22.50 |
|          34540 |       3 |     89720 |        2 |      21.98 |
|          34541 |       1 |     88568 |        2 |      84.20 |
|          67589 |       1 |     67833 |        2 |      57.34 |
|          67589 |       2 |     67832 |        2 |      37.12 |
|          67590 |       1 |     67833 |        2 |      57.34 |
|          67590 |       2 |     67832 |        2 |      37.12 |
|          67591 |       1 |     67832 |        1 |      18.56 |
|          67591 |       2 |     67855 |        1 |      12.12 |
|          67592 |       1 |     67833 |        4 |     114.68 |
|          67593 |       1 |     67833 |        2 |      57.34 |
|          67593 |       2 |     67832 |        2 |      37.12 |
+----------------+---------+-----------+----------+------------+
31 rows in set (0.00 sec)

mysql> SELECT * FROM THEMEPARK;
+-----------+---------------+--------------+--------------+
| PARK_CODE | PARK_NAME     | PARK_CITY    | PARK_COUNTRY |
+-----------+---------------+--------------+--------------+
| FR1001    | FairyLand     | PARIS        | FR           |
| NL1202    | Efling        | NOORD        | NL           |
| SP4533    | AdventurePort | BARCELONA    | SP           |
| SW2323    | Labyrinthe    | LAUSANNE     | SW           |
| UK2622    | MiniLand      | WINDSOR      | UK           |
| UK3452    | PleasureLand  | STOKE        | UK           |
| ZA1342    | GoldTown      | JOHANNESBURG | ZA           |
+-----------+---------------+--------------+--------------+
7 rows in set (0.00 sec)

mysql> SELECT * FROM SALES_LINE;
+----------------+---------+-----------+----------+------------+
| TRANSACTION_NO | LINE_NO | TICKET_NO | LINE_QTY | LINE_PRICE |
+----------------+---------+-----------+----------+------------+
|          12781 |       1 |     13002 |        2 |      69.98 |
|          12781 |       2 |     13001 |        1 |      14.99 |
|          12782 |       1 |     13002 |        2 |      69.98 |
|          12783 |       1 |     13003 |        2 |      41.98 |
|          12784 |       2 |     13001 |        1 |      14.99 |
|          12785 |       1 |     13001 |        1 |      14.99 |
|          12785 |       2 |     13002 |        1 |      34.99 |
|          12785 |       3 |     13002 |        4 |     139.96 |
|          34534 |       1 |     88568 |        4 |     168.40 |
|          34534 |       2 |     88567 |        1 |      22.50 |
|          34534 |       3 |     89720 |        2 |      21.98 |
|          34535 |       1 |     88568 |        2 |      84.20 |
|          34536 |       1 |     89720 |        2 |      21.98 |
|          34537 |       1 |     88568 |        2 |      84.20 |
|          34537 |       2 |     88567 |        1 |      22.50 |
|          34538 |       1 |     89720 |        2 |      21.98 |
|          34539 |       1 |     89720 |        2 |      21.98 |
|          34539 |       2 |     88568 |        2 |      84.20 |
|          34540 |       1 |     88568 |        4 |     168.40 |
|          34540 |       2 |     88567 |        1 |      22.50 |
|          34540 |       3 |     89720 |        2 |      21.98 |
|          34541 |       1 |     88568 |        2 |      84.20 |
|          67589 |       1 |     67833 |        2 |      57.34 |
|          67589 |       2 |     67832 |        2 |      37.12 |
|          67590 |       1 |     67833 |        2 |      57.34 |
|          67590 |       2 |     67832 |        2 |      37.12 |
|          67591 |       1 |     67832 |        1 |      18.56 |
|          67591 |       2 |     67855 |        1 |      12.12 |
|          67592 |       1 |     67833 |        4 |     114.68 |
|          67593 |       1 |     67833 |        2 |      57.34 |
|          67593 |       2 |     67832 |        2 |      37.12 |
+----------------+---------+-----------+----------+------------+
31 rows in set (0.00 sec)

mysql> 
mysql> 
mysql> 
mysql> 
mysql> 
mysql> 
mysql> 
mysql> 
mysql> 
mysql> 
mysql> SELECT * FROM SLAES;
ERROR 1146 (42S02): Table 'themepark.SLAES' doesn't exist
mysql> SELECT * FROM SALES;
+----------------+-----------+------------+
| TRANSACTION_NO | PARK_CODE | SALE_DATE  |
+----------------+-----------+------------+
|          12781 | FR1001    | 2007-05-18 |
|          12782 | FR1001    | 2007-05-18 |
|          12783 | FR1001    | 2007-05-18 |
|          12784 | FR1001    | 2007-05-18 |
|          12785 | FR1001    | 2007-05-18 |
|          12786 | FR1001    | 2007-05-18 |
|          34534 | UK3452    | 2007-05-18 |
|          34535 | UK3452    | 2007-05-18 |
|          34536 | UK3452    | 2007-05-18 |
|          34537 | UK3452    | 2007-05-18 |
|          34538 | UK3452    | 2007-05-18 |
|          34539 | UK3452    | 2007-05-18 |
|          34540 | UK3452    | 2007-05-18 |
|          34541 | UK3452    | 2007-05-18 |
|          67589 | ZA1342    | 2007-05-18 |
|          67590 | ZA1342    | 2007-05-18 |
|          67591 | ZA1342    | 2007-05-18 |
|          67592 | ZA1342    | 2007-05-18 |
|          67593 | ZA1342    | 2007-05-18 |
+----------------+-----------+------------+
19 rows in set (0.00 sec)

mysql> SELECT * FROM THEMEPARK;
+-----------+---------------+--------------+--------------+
| PARK_CODE | PARK_NAME     | PARK_CITY    | PARK_COUNTRY |
+-----------+---------------+--------------+--------------+
| FR1001    | FairyLand     | PARIS        | FR           |
| NL1202    | Efling        | NOORD        | NL           |
| SP4533    | AdventurePort | BARCELONA    | SP           |
| SW2323    | Labyrinthe    | LAUSANNE     | SW           |
| UK2622    | MiniLand      | WINDSOR      | UK           |
| UK3452    | PleasureLand  | STOKE        | UK           |
| ZA1342    | GoldTown      | JOHANNESBURG | ZA           |
+-----------+---------------+--------------+--------------+
7 rows in set (0.00 sec)

mysql> SELECT * FROM TICKET;
+-----------+--------------+-------------+-----------+
| TICKET_NO | TICKET_PRICE | TICKET_TYPE | PARK_CODE |
+-----------+--------------+-------------+-----------+
|     11001 |        24.99 | Adult       | SP4533    |
|     11002 |        14.99 | Child       | SP4533    |
|     11003 |        10.99 | Senior      | SP4533    |
|     13001 |        18.99 | Child       | FR1001    |
|     13002 |        34.99 | Adult       | FR1001    |
|     13003 |        20.99 | Senior      | FR1001    |
|     67832 |        18.56 | Child       | ZA1342    |
|     67833 |        28.67 | Adult       | ZA1342    |
|     67855 |        12.12 | Senior      | ZA1342    |
|     88567 |        22.50 | Child       | UK3452    |
|     88568 |        42.10 | Adult       | UK3452    |
|     89720 |        10.99 | Senior      | UK3452    |
+-----------+--------------+-------------+-----------+
12 rows in set (0.00 sec)

mysql> SELECT * FROM EMPLOYEE;
+---------+-----------+------------+-----------+------------+---------------+---------------+-----------+-----------+
| EMP_NUM | EMP_TITLE | EMP_LNAME  | EMP_FNAME | EMP_DOB    | EMP_HIRE_DATE | EMP_AREA_CODE | EMP_PHONE | PARK_CODE |
+---------+-----------+------------+-----------+------------+---------------+---------------+-----------+-----------+
|     100 | Ms        | Calderdale | Emma      | 1972-06-15 | 1992-03-15    | 0181          | 324-9134  | UK3452    |
|     101 | Ms        | Ricardo    | Marshel   | 1978-03-19 | 1996-04-25    | 0181          | 324-4472  | UK3452    |
|     102 | Mr        | Arshad     | Arif      | 1969-11-14 | 1990-12-20    | 7253          | 675-8993  | FR1001    |
|     103 | Ms        | Roberts    | Anne      | 1974-10-16 | 1994-08-16    | 0181          | 898-3456  | UK3452    |
|     104 | Mr        | Denver     | Enrica    | 1980-11-08 | 2001-10-20    | 7253          | 504-4434  | ZA1342    |
|     105 | Ms        | Namowa     | Mirrelle  | 1990-03-14 | 2006-11-08    | 0181          | 890-3243  | FR1001    |
|     106 | Mrs       | Smith      | Gemma     | 1968-02-12 | 1989-01-05    | 0181          | 324-7845  | ZA1342    |
+---------+-----------+------------+-----------+------------+---------------+---------------+-----------+-----------+
7 rows in set (0.00 sec)

mysql> SELECT EMP_NUM,PARK_CODE,PARK_NAME,EMP_LNAME,EMP_FNAME,EMP_HIRE_DATE,EMP_DOB FROM EMPLOYEE NATURAL JOIN THEMEPARK;
+---------+-----------+--------------+------------+-----------+---------------+------------+
| EMP_NUM | PARK_CODE | PARK_NAME    | EMP_LNAME  | EMP_FNAME | EMP_HIRE_DATE | EMP_DOB    |
+---------+-----------+--------------+------------+-----------+---------------+------------+
|     100 | UK3452    | PleasureLand | Calderdale | Emma      | 1992-03-15    | 1972-06-15 |
|     101 | UK3452    | PleasureLand | Ricardo    | Marshel   | 1996-04-25    | 1978-03-19 |
|     102 | FR1001    | FairyLand    | Arshad     | Arif      | 1990-12-20    | 1969-11-14 |
|     103 | UK3452    | PleasureLand | Roberts    | Anne      | 1994-08-16    | 1974-10-16 |
|     104 | ZA1342    | GoldTown     | Denver     | Enrica    | 2001-10-20    | 1980-11-08 |
|     105 | FR1001    | FairyLand    | Namowa     | Mirrelle  | 2006-11-08    | 1990-03-14 |
|     106 | ZA1342    | GoldTown     | Smith      | Gemma     | 1989-01-05    | 1968-02-12 |
+---------+-----------+--------------+------------+-----------+---------------+------------+
7 rows in set (0.00 sec)

mysql> CREATE VIEW EMPLOYEE_DETAIL AS SELECT EMP_NUM,PARK_CODE,PARK_NAME,EMP_LNAME,EMP_FNAME,EMP_HIRE_DATE,EMP_DOB FROM EMPLOYEE NATURAL JOIN THEMEPARK;
Query OK, 0 rows affected (0.21 sec)

mysql> SELECT * FROM EMPLOYEE_DETAIL;
+---------+-----------+--------------+------------+-----------+---------------+------------+
| EMP_NUM | PARK_CODE | PARK_NAME    | EMP_LNAME  | EMP_FNAME | EMP_HIRE_DATE | EMP_DOB    |
+---------+-----------+--------------+------------+-----------+---------------+------------+
|     100 | UK3452    | PleasureLand | Calderdale | Emma      | 1992-03-15    | 1972-06-15 |
|     101 | UK3452    | PleasureLand | Ricardo    | Marshel   | 1996-04-25    | 1978-03-19 |
|     102 | FR1001    | FairyLand    | Arshad     | Arif      | 1990-12-20    | 1969-11-14 |
|     103 | UK3452    | PleasureLand | Roberts    | Anne      | 1994-08-16    | 1974-10-16 |
|     104 | ZA1342    | GoldTown     | Denver     | Enrica    | 2001-10-20    | 1980-11-08 |
|     105 | FR1001    | FairyLand    | Namowa     | Mirrelle  | 2006-11-08    | 1990-03-14 |
|     106 | ZA1342    | GoldTown     | Smith      | Gemma     | 1989-01-05    | 1968-02-12 |
+---------+-----------+--------------+------------+-----------+---------------+------------+
7 rows in set (0.01 sec)

mysql> DESCRIBE EMPLOYEE_DETAIL;
+---------------+--------------+------+-----+---------+-------+
| Field         | Type         | Null | Key | Default | Extra |
+---------------+--------------+------+-----+---------+-------+
| EMP_NUM       | decimal(4,0) | NO   |     | NULL    |       |
| PARK_CODE     | varchar(10)  | YES  |     | NULL    |       |
| PARK_NAME     | varchar(35)  | NO   |     | NULL    |       |
| EMP_LNAME     | varchar(15)  | NO   |     | NULL    |       |
| EMP_FNAME     | varchar(15)  | NO   |     | NULL    |       |
| EMP_HIRE_DATE | date         | YES  |     | NULL    |       |
| EMP_DOB       | date         | NO   |     | NULL    |       |
+---------------+--------------+------+-----+---------+-------+
7 rows in set (0.00 sec)

mysql> CREATE VIEW EMPLOYEE_DETAIL AS SELECT PARK_NAME,EMP_LNAME,EMP_FNAME;
ERROR 1054 (42S22): Unknown column 'PARK_NAME' in 'field list'
mysql> CREATE VIEW EMPLOYEE_DETAIL AS SELECT PARK_NAME,EMP_LNAME,EMP_FNAME FROM EMPLOYEE NATURAL JOIN THEMEPARK;
ERROR 1050 (42S01): Table 'EMPLOYEE_DETAIL' already exists
mysql> 
mysql> SELECT * FROM EMPLOYEE_DETAIL;
+---------+-----------+--------------+------------+-----------+---------------+------------+
| EMP_NUM | PARK_CODE | PARK_NAME    | EMP_LNAME  | EMP_FNAME | EMP_HIRE_DATE | EMP_DOB    |
+---------+-----------+--------------+------------+-----------+---------------+------------+
|     100 | UK3452    | PleasureLand | Calderdale | Emma      | 1992-03-15    | 1972-06-15 |
|     101 | UK3452    | PleasureLand | Ricardo    | Marshel   | 1996-04-25    | 1978-03-19 |
|     102 | FR1001    | FairyLand    | Arshad     | Arif      | 1990-12-20    | 1969-11-14 |
|     103 | UK3452    | PleasureLand | Roberts    | Anne      | 1994-08-16    | 1974-10-16 |
|     104 | ZA1342    | GoldTown     | Denver     | Enrica    | 2001-10-20    | 1980-11-08 |
|     105 | FR1001    | FairyLand    | Namowa     | Mirrelle  | 2006-11-08    | 1990-03-14 |
|     106 | ZA1342    | GoldTown     | Smith      | Gemma     | 1989-01-05    | 1968-02-12 |
+---------+-----------+--------------+------------+-----------+---------------+------------+
7 rows in set (0.00 sec)

mysql> SELECT PARK_NAME,EMP_FNAME,EMP_LNAME FROM EMPLOYEE_DETAIL;
+--------------+-----------+------------+
| PARK_NAME    | EMP_FNAME | EMP_LNAME  |
+--------------+-----------+------------+
| PleasureLand | Emma      | Calderdale |
| PleasureLand | Marshel   | Ricardo    |
| FairyLand    | Arif      | Arshad     |
| PleasureLand | Anne      | Roberts    |
| GoldTown     | Enrica    | Denver     |
| FairyLand    | Mirrelle  | Namowa     |
| GoldTown     | Gemma     | Smith      |
+--------------+-----------+------------+
7 rows in set (0.00 sec)

mysql> CREATE VIEW EMP_DETAILS AS SELECT EMP_NUM, EMPLOYEE.PARK_CODE,PARK_NAME, EMP_LNAME, EMP_FNAME, EMP_HIRE_DATE,EMP_DOB FROM EMPLOYEE, THEMEPARK WHERE THEMEPARK.PARK_CODE = EMPLOYEE.PARK_CODE;
Query OK, 0 rows affected (0.27 sec)

mysql> SLECT * FROM TICKETL
    -> ;
ERROR 1064 (42000): You have an error in your SQL syntax; check the manual that corresponds to your MySQL server version for the right syntax to use near 'SLECT * FROM TICKETL' at line 1
mysql> SELECT * FROM TICKETL
    -> ;
ERROR 1146 (42S02): Table 'themepark.TICKETL' doesn't exist
mysql> SELECT * FROM TICKET;
+-----------+--------------+-------------+-----------+
| TICKET_NO | TICKET_PRICE | TICKET_TYPE | PARK_CODE |
+-----------+--------------+-------------+-----------+
|     11001 |        24.99 | Adult       | SP4533    |
|     11002 |        14.99 | Child       | SP4533    |
|     11003 |        10.99 | Senior      | SP4533    |
|     13001 |        18.99 | Child       | FR1001    |
|     13002 |        34.99 | Adult       | FR1001    |
|     13003 |        20.99 | Senior      | FR1001    |
|     67832 |        18.56 | Child       | ZA1342    |
|     67833 |        28.67 | Adult       | ZA1342    |
|     67855 |        12.12 | Senior      | ZA1342    |
|     88567 |        22.50 | Child       | UK3452    |
|     88568 |        42.10 | Adult       | UK3452    |
|     89720 |        10.99 | Senior      | UK3452    |
+-----------+--------------+-------------+-----------+
12 rows in set (0.00 sec)

mysql> SELECT * FROM THEMEPARK;
+-----------+---------------+--------------+--------------+
| PARK_CODE | PARK_NAME     | PARK_CITY    | PARK_COUNTRY |
+-----------+---------------+--------------+--------------+
| FR1001    | FairyLand     | PARIS        | FR           |
| NL1202    | Efling        | NOORD        | NL           |
| SP4533    | AdventurePort | BARCELONA    | SP           |
| SW2323    | Labyrinthe    | LAUSANNE     | SW           |
| UK2622    | MiniLand      | WINDSOR      | UK           |
| UK3452    | PleasureLand  | STOKE        | UK           |
| ZA1342    | GoldTown      | JOHANNESBURG | ZA           |
+-----------+---------------+--------------+--------------+
7 rows in set (0.00 sec)

mysql> SELECT * FROM SLAE_LINE;
ERROR 1146 (42S02): Table 'themepark.SLAE_LINE' doesn't exist
mysql> SELECT * FROM SLAES_LINE;
ERROR 1146 (42S02): Table 'themepark.SLAES_LINE' doesn't exist
mysql> SHOW TABLES
    -> ;
+---------------------+
| Tables_in_themepark |
+---------------------+
| ATTRACTION          |
| EMPLOYEE            |
| EMPLOYEE_DETAIL     |
| EMP_DETAILS         |
| EMP_WORKED          |
| HOURS               |
| SALES               |
| SALES_LINE          |
| THEMEPARK           |
| TICKET              |
+---------------------+
10 rows in set (0.01 sec)

mysql> SELECT * FROM SALES_LINE;
+----------------+---------+-----------+----------+------------+
| TRANSACTION_NO | LINE_NO | TICKET_NO | LINE_QTY | LINE_PRICE |
+----------------+---------+-----------+----------+------------+
|          12781 |       1 |     13002 |        2 |      69.98 |
|          12781 |       2 |     13001 |        1 |      14.99 |
|          12782 |       1 |     13002 |        2 |      69.98 |
|          12783 |       1 |     13003 |        2 |      41.98 |
|          12784 |       2 |     13001 |        1 |      14.99 |
|          12785 |       1 |     13001 |        1 |      14.99 |
|          12785 |       2 |     13002 |        1 |      34.99 |
|          12785 |       3 |     13002 |        4 |     139.96 |
|          34534 |       1 |     88568 |        4 |     168.40 |
|          34534 |       2 |     88567 |        1 |      22.50 |
|          34534 |       3 |     89720 |        2 |      21.98 |
|          34535 |       1 |     88568 |        2 |      84.20 |
|          34536 |       1 |     89720 |        2 |      21.98 |
|          34537 |       1 |     88568 |        2 |      84.20 |
|          34537 |       2 |     88567 |        1 |      22.50 |
|          34538 |       1 |     89720 |        2 |      21.98 |
|          34539 |       1 |     89720 |        2 |      21.98 |
|          34539 |       2 |     88568 |        2 |      84.20 |
|          34540 |       1 |     88568 |        4 |     168.40 |
|          34540 |       2 |     88567 |        1 |      22.50 |
|          34540 |       3 |     89720 |        2 |      21.98 |
|          34541 |       1 |     88568 |        2 |      84.20 |
|          67589 |       1 |     67833 |        2 |      57.34 |
|          67589 |       2 |     67832 |        2 |      37.12 |
|          67590 |       1 |     67833 |        2 |      57.34 |
|          67590 |       2 |     67832 |        2 |      37.12 |
|          67591 |       1 |     67832 |        1 |      18.56 |
|          67591 |       2 |     67855 |        1 |      12.12 |
|          67592 |       1 |     67833 |        4 |     114.68 |
|          67593 |       1 |     67833 |        2 |      57.34 |
|          67593 |       2 |     67832 |        2 |      37.12 |
+----------------+---------+-----------+----------+------------+
31 rows in set (0.00 sec)

mysql> SELECT MIN(LINE_PRICE), MAX(LINE_PRICE) FROM SALES_LINE;
+-----------------+-----------------+
| MIN(LINE_PRICE) | MAX(LINE_PRICE) |
+-----------------+-----------------+
|           12.12 |          168.40 |
+-----------------+-----------------+
1 row in set (0.08 sec)

mysql> SELECT MIN(LINE_PRICE), MAX(LINE_PRICE) FROM SALES_LINE NATURAL JOIN THEMEPARK 
    -> D EDEDEFE;;
ERROR 1064 (42000): You have an error in your SQL syntax; check the manual that corresponds to your MySQL server version for the right syntax to use near 'EDEDEFE' at line 2
ERROR: 
No query specified

mysql> 
mysql> 
mysql> 
mysql> 
mysql> 
mysql> 
mysql> 
mysql> SELECT PARK_NAME,MIN(LINE_PRICE), MAX(LINE_PRICE),AVG(LINE_PRICE) FROM SALES_LINE NATURAL JOIN THEMEPARK;
ERROR 1140 (42000): In aggregated query without GROUP BY, expression #1 of SELECT list contains nonaggregated column 'themepark.THEMEPARK.PARK_NAME'; this is incompatible with sql_mode=only_full_group_by
mysql> SELECT PARK_NAME,MIN(LINE_PRICE), MAX(LINE_PRICE),AVG(LINE_PRICE) FROM SALES_LINE NATURAL JOIN THEMEPARK GROUP BY PARK_CODE;
+---------------+-----------------+-----------------+-----------------+
| PARK_NAME     | MIN(LINE_PRICE) | MAX(LINE_PRICE) | AVG(LINE_PRICE) |
+---------------+-----------------+-----------------+-----------------+
| GoldTown      |           12.12 |          168.40 |       54.245161 |
| PleasureLand  |           12.12 |          168.40 |       54.245161 |
| MiniLand      |           12.12 |          168.40 |       54.245161 |
| Labyrinthe    |           12.12 |          168.40 |       54.245161 |
| AdventurePort |           12.12 |          168.40 |       54.245161 |
| Efling        |           12.12 |          168.40 |       54.245161 |
| FairyLand     |           12.12 |          168.40 |       54.245161 |
+---------------+-----------------+-----------------+-----------------+
7 rows in set (0.00 sec)

mysql> SELECT PARK_NAME,MIN(LINE_PRICE), MAX(LINE_PRICE),AVG(LINE_PRICE) FROM SALES_LINE NATURAL JOIN THEMEPARK GROUP BY PARK_CODE;
+---------------+-----------------+-----------------+-----------------+
| PARK_NAME     | MIN(LINE_PRICE) | MAX(LINE_PRICE) | AVG(LINE_PRICE) |
+---------------+-----------------+-----------------+-----------------+
| GoldTown      |           12.12 |          168.40 |       54.245161 |
| PleasureLand  |           12.12 |          168.40 |       54.245161 |
| MiniLand      |           12.12 |          168.40 |       54.245161 |
| Labyrinthe    |           12.12 |          168.40 |       54.245161 |
| AdventurePort |           12.12 |          168.40 |       54.245161 |
| Efling        |           12.12 |          168.40 |       54.245161 |
| FairyLand     |           12.12 |          168.40 |       54.245161 |
+---------------+-----------------+-----------------+-----------------+
7 rows in set (0.00 sec)

mysql>
